{
  "schemaVersion": 1,
  "updated": "2026-06-10",
  "note": "Per-build expected enablement behavior for Microsoft's native NVMe driver on Windows client. First matching rule wins (rules are ordered most-specific first). 'expectedPath' values: registry-override | vivetool-fallback | none-known | official-optin. Microsoft changes this behavior out-of-band — update this file (a user-edited copy in %LocalAppData%\\NVMePatcher takes precedence over the bundled one).",
  "rules": [
    {
      "id": "server-2025",
      "server": true,
      "minBuild": 26100,
      "maxBuild": 99999,
      "minUbr": 0,
      "maxUbr": 999999,
      "expectedPath": "official-optin",
      "summary": "Windows Server 2025: native NVMe is an official, supported opt-in feature (GA after the October 2025 cumulative). Use Microsoft's documented enablement, not client-style overrides.",
      "sourceUrl": "https://techcommunity.microsoft.com/blog/windowsservernewsandbestpractices/announcing-native-nvme-in-windows-server-2025-ushering-in-a-new-era-of-storage-p/4477353",
      "confidence": "verified",
      "lastReviewed": "2026-06-10"
    },
    {
      "id": "post-26200-trains-bind-blocked",
      "server": false,
      "minBuild": 26201,
      "maxBuild": 99999,
      "minUbr": 0,
      "maxUbr": 999999,
      "expectedPath": "none-known",
      "summary": "Insider trains newer than 26200 (26H1 28020/28120 and later) inherit the GenNvmeDisk compatible-ID removal — no working enablement path is known. Wait for Microsoft's official client rollout.",
      "sourceUrl": "https://github.com/thebookisclosed/ViVe/issues/164",
      "confidence": "community-reported",
      "lastReviewed": "2026-06-10"
    },
    {
      "id": "26200-bind-blocked",
      "server": false,
      "minBuild": 26200,
      "maxBuild": 26200,
      "minUbr": 8524,
      "maxUbr": 999999,
      "expectedPath": "none-known",
      "summary": "Builds 26200.8524+ (and newer Insider trains): stornvme no longer exposes the GenNvmeDisk compatible ID, so nvmedisk.inf cannot match — registry AND ViVeTool routes both enable flags that have no effect. No working enablement path is known; wait for Microsoft's official client rollout.",
      "sourceUrl": "https://github.com/thebookisclosed/ViVe/issues/164",
      "confidence": "community-reported",
      "lastReviewed": "2026-06-10"
    },
    {
      "id": "25h2-vivetool-new-ids",
      "server": false,
      "minBuild": 26200,
      "maxBuild": 26200,
      "minUbr": 0,
      "maxUbr": 8523,
      "expectedPath": "vivetool-fallback",
      "fallbackSet": "native-nvme-stack-25h2",
      "summary": "25H2 (26200.x before .8524): the registry override is neutered; the ViVeTool fallback works with the newer ID set (55369237 + 48433719 + 49453572 — 60786016 reportedly no longer exists on these builds).",
      "sourceUrl": "https://www.elevenforum.com/t/windows-11-25h2-nvmedisk-sys-driver-support.46678/",
      "confidence": "community-reported",
      "lastReviewed": "2026-06-10"
    },
    {
      "id": "24h2-post-block",
      "server": false,
      "minBuild": 26100,
      "maxBuild": 26199,
      "minUbr": 3775,
      "maxUbr": 999999,
      "expectedPath": "vivetool-fallback",
      "fallbackSet": "post-block-2026-03",
      "summary": "24H2 with Feb/Mar 2026+ servicing: Microsoft neutered the FeatureManagement\\Overrides registry route (keys write successfully but the driver never binds). The ViVeTool fallback (60786016 + 48433719) still works.",
      "sourceUrl": "https://www.tomshardware.com/software/windows/microsoft-blocks-the-registry-hack-trick-that-unlocked-native-nvme-performance-on-windows-11",
      "confidence": "verified",
      "lastReviewed": "2026-06-10"
    },
    {
      "id": "24h2-pre-block",
      "server": false,
      "minBuild": 26100,
      "maxBuild": 26199,
      "minUbr": 0,
      "maxUbr": 3774,
      "expectedPath": "registry-override",
      "summary": "24H2 before the Feb/Mar 2026 servicing block: the registry override route works as originally documented.",
      "sourceUrl": "https://www.tomshardware.com/pc-components/ssds/windows-11s-secret-nvme-performance-switch",
      "confidence": "verified",
      "lastReviewed": "2026-06-10"
    },
    {
      "id": "pre-24h2",
      "server": false,
      "minBuild": 0,
      "maxBuild": 26099,
      "minUbr": 0,
      "maxUbr": 999999,
      "expectedPath": "registry-override",
      "summary": "Pre-24H2 builds: the native NVMe components may be missing or incomplete; the registry route writes but the driver frequently is not present. 24H2+ is recommended.",
      "sourceUrl": "https://techcommunity.microsoft.com/blog/windowsservernewsandbestpractices/announcing-native-nvme-in-windows-server-2025-ushering-in-a-new-era-of-storage-p/4477353",
      "confidence": "verified",
      "lastReviewed": "2026-06-10"
    }
  ]
}
