{
  "schemaVersion": 1,
  "updated": "2026-10-05",
  "note": "Per-build expected enablement behavior for Microsoft's native NVMe driver on Windows client. First matching rule wins (rules are ordered most-specific first). 'expectedPath' values: registry-override | vivetool-fallback | none-known | official-optin. Microsoft changes this behavior out-of-band — update this file (an administrator-owned copy in %ProgramData%\\NVMePatcher\\State takes precedence over the bundled one).",
  "rules": [
    {
      "id": "server-2025",
      "server": true,
      "minBuild": 26100,
      "maxBuild": 99999,
      "minUbr": 0,
      "maxUbr": 999999,
      "expectedPath": "official-optin",
      "summary": "Windows Server 2025: native NVMe is an official, supported opt-in feature (GA after the October 2025 cumulative). Use Microsoft's documented enablement, not client-style overrides.",
      "sourceUrl": "https://techcommunity.microsoft.com/blog/windowsservernewsandbestpractices/announcing-native-nvme-in-windows-server-2025-ushering-in-a-new-era-of-storage-p/4477353",
      "confidence": "verified",
      "lastReviewed": "2026-10-05"
    },
    {
      "id": "26300-feature-flags-page",
      "server": false,
      "minBuild": 26300,
      "maxBuild": 99999,
      "minUbr": 0,
      "maxUbr": 999999,
      "expectedPath": "none-known",
      "summary": "Build 26300+ (26H2 Experimental) ships a native 'Feature flags' page (Settings > Windows Update > Windows Insider Program), confirmed in Microsoft's own release notes. Check there first: Microsoft may expose native NVMe as an official toggle, which is preferable to these overrides. As of the 2026-10-05 review it isn't listed there, and the GenNvmeDisk compatible ID is still removed on these trains (ViVe issue 164), so the registry and ViVeTool routes don't bind the driver. Treat this tool as verify/monitor/rollback until an official toggle appears.",
      "sourceUrl": "https://learn.microsoft.com/en-us/windows-insider/release-notes/experimental/preview-build-26300-9032",
      "confidence": "community-reported",
      "lastReviewed": "2026-10-05"
    },
    {
      "id": "post-26200-trains-bind-blocked",
      "server": false,
      "minBuild": 26201,
      "maxBuild": 99999,
      "minUbr": 0,
      "maxUbr": 999999,
      "expectedPath": "none-known",
      "summary": "Insider trains newer than 26200 (26H1 28020/28120 and later) inherit the GenNvmeDisk compatible-ID removal, so no working enablement path is known. Candidate probe 48613417 (NativeNVMeStackEnableForClientOS) is untested on this branch; source: https://github.com/phantomofearth/windows-velocity-feature-lists. Applying it remains gated behind live validation. Wait for Microsoft's official client rollout.",
      "sourceUrl": "https://github.com/thebookisclosed/ViVe/issues/164",
      "confidence": "community-reported",
      "lastReviewed": "2026-10-05"
    },
    {
      "id": "26200-bind-blocked",
      "server": false,
      "minBuild": 26200,
      "maxBuild": 26200,
      "minUbr": 8524,
      "maxUbr": 999999,
      "expectedPath": "none-known",
      "summary": "Evidenced on Insider 26200.8524 (ViVe issue 164): stornvme stopped exposing the GenNvmeDisk compatible ID, so nvmedisk.inf can't match and both the registry and ViVeTool routes set flags that have no effect. Retail 25H2 UBRs above 8524 have no exact sourced evidence either way, so they stay verify/monitor/rollback. Candidate probe 48613417 (NativeNVMeStackEnableForClientOS) is untested on this branch; source: https://github.com/phantomofearth/windows-velocity-feature-lists. Applying it remains gated behind live validation. No working enablement path is known; wait for Microsoft's official client rollout.",
      "sourceUrl": "https://github.com/thebookisclosed/ViVe/issues/164",
      "confidence": "community-reported",
      "lastReviewed": "2026-10-05"
    },
    {
      "id": "25h2-vivetool-new-ids",
      "server": false,
      "minBuild": 26200,
      "maxBuild": 26200,
      "minUbr": 0,
      "maxUbr": 8523,
      "expectedPath": "vivetool-fallback",
      "fallbackSet": "native-nvme-stack-25h2",
      "summary": "25H2 (26200.x before .8524): the registry override is neutered, and the FeatureStore fallback applies 55369237 + 48433719 (49453572 is Always Enabled and probe-only). One forum report also has 60786016 + 48433719 binding on 26200.8116/.8117; this set doesn't use it.",
      "sourceUrl": "https://www.elevenforum.com/t/windows-11-25h2-nvmedisk-sys-driver-support.46678/",
      "confidence": "community-reported",
      "lastReviewed": "2026-10-05"
    },
    {
      "id": "24h2-26100-8106-fallback",
      "server": false,
      "minBuild": 26100,
      "maxBuild": 26100,
      "minUbr": 8106,
      "maxUbr": 8106,
      "expectedPath": "vivetool-fallback",
      "fallbackSet": "post-block-2026-03",
      "summary": "Windows 11 build 26100.8106 is where the original FeatureManagement override set stopped binding, while the FeatureStore fallback was reported working. A newer three-value override set has since been reported binding on 26100.8457 and 26100.9550 (see the 24H2 rule below). This exact rule must not be extrapolated to adjacent UBRs.",
      "sourceUrl": "https://forums.mydigitallife.net/threads/discussion-windows-11-26x00-native-nvme-driver-discussion.89933/page-10",
      "confidence": "community-verified",
      "lastReviewed": "2026-10-05"
    },
    {
      "id": "24h2-client-unverified",
      "server": false,
      "minBuild": 26100,
      "maxBuild": 26199,
      "minUbr": 0,
      "maxUbr": 999999,
      "expectedPath": "none-known",
      "summary": "No primary Microsoft client matrix or sufficiently precise public evidence establishes a working enablement path for this 24H2 build/UBR. Do not extrapolate from 26100.8106; verify, monitor, or roll back only until an exact rule is sourced.",
      "sourceUrl": "https://techcommunity.microsoft.com/blog/windowsservernewsandbestpractices/announcing-native-nvme-in-windows-server-2025-ushering-in-a-new-era-of-storage-p/4477353",
      "confidence": "conservative-default",
      "lastReviewed": "2026-10-05"
    },
    {
      "id": "pre-24h2",
      "server": false,
      "minBuild": 0,
      "maxBuild": 26099,
      "minUbr": 0,
      "maxUbr": 999999,
      "expectedPath": "none-known",
      "summary": "Pre-24H2 client builds have no sourced working enablement interval and may lack complete native NVMe components. The tool is verify/monitor/rollback-only; writing override keys is not evidence that the driver can bind.",
      "sourceUrl": "https://techcommunity.microsoft.com/blog/windowsservernewsandbestpractices/announcing-native-nvme-in-windows-server-2025-ushering-in-a-new-era-of-storage-p/4477353",
      "confidence": "conservative-default",
      "lastReviewed": "2026-10-05"
    }
  ]
}
